,IdAcc,RefCper,txtdef_fis_prev,txtlocLes,txtkitSeg,txthcondc,txtPsi,txtaccion_cond,txtinfrvel,txtinfradm,txtinfrcond,txtposenveh,txtposenveh2,txtLesividad,txtinfrpeat,txtaccion_peat,txtNcionalidad,txtPermisoConducir,IdPer,Referencia,nCor,ordPer,VehNum,Sexo,cSexo,Edad,dBorn,gEdad,AÑO,CodTipoAcci,CodSubTipoAcc,tipoTrav,TipoNodo,BS_P85sp,txtTIPOACCI,txtwACC2,txtFACTCON1,cLesividad,nLesividad,ngEdad,Infr_Velocidad,Infr_Cond,IdSubred,Subred,txtTipoVia
0,12.0,142A050001141,Sin defecto conocido,Pecho,Utilizando cinturón,Menos de 1,Aparentemente normal,Siguiendo ruta,Se ignora,Se ignora,Se ignora,Parte delantera izquierda ,Conductor,Leve,Sin datos,Sin datos,Nigeria,B1                         ,35,142A0500011,41.0,1.0,1.0,1.0,Hombre,29.0,19751212,Entre 20 y 34 años,2005.0,SVC_B_I,SV,,,86.0,Choque con cuneta o bordillo,Salida de la calzada por la derecha con choque con cuneta o bordillo,Velocidad inadecuada,L,2,2,Sin Datos,Sin Datos,0,Red de Alta Capacidad Metropolitana,Autopista Libre o Autovia
1,24.0,553A050000353,Sin defecto conocido,Sin datos,Utilizando cinturón,Menos de 1,Aparentemente normal,Siguiendo ruta,Se ignora,Ninguna,Se ignora,Parte delantera izquierda ,Conductor,Ileso,Sin datos,Sin datos,España,B                          ,71,553A0500003,53.0,1.0,1.0,1.0,Hombre,38.0,19660510,Entre 35 y 44 años,2005.0,OC_X,XXX,,Rotonda,75.0,Otro,Otro tipo de accidente,Velocidad inadecuada,I,1,3,Sin Datos,Sin Datos,2,Red Básica (Naranja),Autopista Libre o Autovia
2,24.0,553A050000353,Sin defecto conocido,Cuello,Utilizando cinturón,Menos de 1,Aparentemente normal,Siguiendo ruta,Se ignora,Ninguna,Se ignora,Parte delantera izquierda ,Conductor,Leve,Sin datos,Sin datos,España,B                          ,72,553A0500003,53.0,2.0,2.0,2.0,Mujer,34.0,19700609,Entre 20 y 34 años,2005.0,OC_X,XXX,,Rotonda,75.0,Otro,Otro tipo de accidente,Velocidad inadecuada,L,2,2,Sin Datos,Sin Datos,2,Red Básica (Naranja),Autopista Libre o Autovia
3,13.0,142A050001242,Sin defecto conocido,Sin datos,Utilizando cinturón,Menos de 1,Aparentemente normal,Parado o estacionado,Ninguna,Ninguna,Ninguna infracción,Parte delantera izquierda ,Conductor,Ileso,Sin datos,Sin datos,España,B                          ,39,142A0500012,42.0,4.0,4.0,1.0,Hombre,45.0,19591228,Entre 45 y 65 años,2005.0,CM,CM,,,103.0,Múltiple o en caravana,Colisión múltiple de vehículos en marcha,Infracción a norma de circulación,I,1,4,Ninguna,Ninguna infracción,0,Red de Alta Capacidad Metropolitana,Autopista Libre o Autovia
4,13.0,142A050001242,Sin defecto conocido,Sin datos,Utilizando cinturón,Menos de 1,Aparentemente normal,Brusca reducción de velocidad,Ninguna,Ninguna,Ninguna infracción,Parte delantera izquierda ,Conductor,Ileso,Sin datos,Sin datos,España,B                          ,36,142A0500012,42.0,1.0,1.0,2.0,Mujer,47.0,19570415,Entre 45 y 65 años,2005.0,CM,CM,,,103.0,Múltiple o en caravana,Colisión múltiple de vehículos en marcha,Infracción a norma de circulación,I,1,4,Ninguna,Ninguna infracción,0,Red de Alta Capacidad Metropolitana,Autopista Libre o Autovia
